{"actions":[],"direction":"CPU_TO_IP_TO_CPU","encoding_version":2,"initial_images":[{"address":65664,"component":"cpu","data_hex":"b70000401301500a23aa200083a14001232030206f000000","image_id":"cpu.program"},{"address":512,"component":"cpu","data_hex":"00000000","image_id":"cpu.data"}],"max_steps":100,"path_id":"deferred-real-mmio","schedule_order":["cpu","gpio"],"testcase_id":"deferred-cpu-gpio-cpu"}
