{"actions":[{"action_id":"first-rise","bit_offset":0,"component":"gpio_b","delay_component":"gpio_b","delay_ticks":4,"direction":"IP_TO_CPU_TO_IP","port":"gpio_in","trigger":{"kind":"START","mask":0,"occurrence":1,"source_component":"","source_port":"","value":0},"value":256,"width":9},{"action_id":"second-low","bit_offset":0,"component":"gpio_b","delay_component":"gpio_b","delay_ticks":40,"direction":"IP_TO_CPU_TO_IP","port":"gpio_in","trigger":{"kind":"START","mask":0,"occurrence":1,"source_component":"","source_port":"","value":0},"value":0,"width":9},{"action_id":"second-rise","bit_offset":0,"component":"gpio_b","delay_component":"gpio_b","delay_ticks":60,"direction":"IP_TO_CPU_TO_IP","port":"gpio_in","trigger":{"kind":"START","mask":0,"occurrence":1,"source_component":"","source_port":"","value":0},"value":256,"width":10}],"direction":"IP_TO_CPU_TO_IP","encoding_version":3,"initial_images":[{"address":65664,"component":"cpu","data_hex":"b70000401301001023a2200023a62002b70201009382021073905230b71200009382028073a042309302800073a002306f000000","image_id":"cpu.main"},{"address":65792,"component":"cpu","data_hex":"b700004003a1000137120040232a2200232020209301001023a0300073002030","image_id":"cpu.isr"},{"address":65836,"component":"cpu","data_hex":"b700004003a1000137120040232a2200232020209301001023a0300073002030","image_id":"cpu.isr.vector"}],"max_steps":270,"path_id":"independent-b-local-source-events","quiesce_steps":16,"reset_actions":[],"schedule_order":["cpu","gpio_b","gpio_a"],"testcase_id":"independent-b-local-source-events"}
