{"actions":[{"action_id":"fixed-b-rise","bit_offset":0,"component":"gpio_b","delay_component":"gpio_b","delay_ticks":40,"direction":"CPU_TO_IP_TO_CPU","port":"gpio_in","trigger":{"kind":"START","mask":0,"occurrence":1,"source_component":"","source_port":"","value":0},"value":1,"width":8}],"direction":"CPU_TO_IP_TO_CPU","encoding_version":2,"initial_images":[{"address":65664,"component":"cpu","data_hex":"b7000040371200401301100023a2200023a62002b70201009382021073905230b71200009382028073a042309302800073a00230232a22006f000000","image_id":"cpu.main"},{"address":65792,"component":"cpu","data_hex":"b700004003a10001232020209301100023a0300037120040232a02001300000013000000232a320073002030","image_id":"cpu.isr"},{"address":65836,"component":"cpu","data_hex":"b700004003a10001232020209301100023a0300037120040232a02001300000013000000232a320073002030","image_id":"cpu.isr.vector"}],"max_steps":3600,"path_id":"isolated_replay.cpu-a-b-fixed-b","schedule_order":["cpu","gpio_a","gpio_b"],"testcase_id":"cpu-a-b-cpu-isolated-b"}
