{"actions":[],"direction":"CPU_TO_IP_TO_CPU","encoding_version":2,"initial_images":[{"address":65664,"component":"cpu","data_hex":"b7000040370100201301110023a820001301500a23ae20001301500023a22000b70201009382021073905230b71200009382028073a042309302800073a002306f000000","image_id":"cpu.main"},{"address":65792,"component":"cpu","data_hex":"b700004003a10000232020209301400023a2300073002030","image_id":"cpu.isr"},{"address":65836,"component":"cpu","data_hex":"b700004003a10000232020209301400023a2300073002030","image_id":"cpu.isr.vector"}],"max_steps":4000,"path_id":"cpu-uart-early-irq-cpu","schedule_order":["cpu","uart"],"testcase_id":"uart-early-irq-cpu"}
