{"actions":[],"direction":"CPU_TO_IP_TO_CPU","encoding_version":2,"initial_images":[{"address":65664,"component":"cpu","data_hex":"b70000409302002013030000b70301009383c31273a05330b71300009383038073a043309303800073a003303701010023a620101301800c23ac201023ae00101301100023a0201023a220006f000000","image_id":"cpu.main"},{"address":65836,"component":"cpu","data_hex":"03a4401083a1001123a032009381810723ac30109382420013031300130220006314430023a200001300000013000000130000001300000013000000130000001300000013000000130000001300000013000000130000001300000013000000130000001300000073002030","image_id":"cpu.isr.vector"}],"max_steps":1600,"path_id":"ibex-mmio-real-timer-irq-ibex-ram","schedule_order":["cpu","timer"],"testcase_id":"ibex-timer-two-rounds"}
