{"actions":[{"action_id":"rx_frame","bit_offset":0,"component":"uart0","delay_component":"uart0","delay_ticks":0,"direction":"CPU_TO_IP_TO_CPU","port":"uart_rx_byte","trigger":{"kind":"AFTER_OUTPUT","mask":4294967295,"occurrence":1,"source_component":"cpu","source_port":"data_addr","value":262156},"value":90,"width":8}],"direction":"CPU_TO_IP_TO_CPU","encoding_version":2,"initial_images":[{"address":0,"component":"cpu","data_hex":"b70004001303000123a060001301100423a62000930300029383f3ffe39e03fe9304400183a2400093f21200639602009384f4ffe39804fe83a180003344310037120000232082006f000000","image_id":"cpu.program"}],"max_steps":1400,"path_id":"picorv32-axil-uart-cpu-roundtrip","schedule_order":["cpu","uart0"],"testcase_id":"axil-picorv32-uart-cpu-seed"}
