{"actions":[{"action_id":"frame-1-bit-0","bit_offset":0,"component":"uart","delay_component":"uart","delay_ticks":128,"direction":"IP_TO_CPU_TO_IP","port":"uart_rx","trigger":{"kind":"AFTER_OUTPUT","mask":4294967295,"occurrence":1,"source_component":"cpu","source_port":"data_addr","value":1073741828},"value":0,"width":null},{"action_id":"frame-1-bit-1","bit_offset":0,"component":"uart","delay_component":"uart","delay_ticks":192,"direction":"IP_TO_CPU_TO_IP","port":"uart_rx","trigger":{"kind":"AFTER_OUTPUT","mask":4294967295,"occurrence":1,"source_component":"cpu","source_port":"data_addr","value":1073741828},"value":1,"width":null},{"action_id":"frame-1-bit-2","bit_offset":0,"component":"uart","delay_component":"uart","delay_ticks":256,"direction":"IP_TO_CPU_TO_IP","port":"uart_rx","trigger":{"kind":"AFTER_OUTPUT","mask":4294967295,"occurrence":1,"source_component":"cpu","source_port":"data_addr","value":1073741828},"value":0,"width":null},{"action_id":"frame-1-bit-3","bit_offset":0,"component":"uart","delay_component":"uart","delay_ticks":320,"direction":"IP_TO_CPU_TO_IP","port":"uart_rx","trigger":{"kind":"AFTER_OUTPUT","mask":4294967295,"occurrence":1,"source_component":"cpu","source_port":"data_addr","value":1073741828},"value":1,"width":null},{"action_id":"frame-1-bit-4","bit_offset":0,"component":"uart","delay_component":"uart","delay_ticks":384,"direction":"IP_TO_CPU_TO_IP","port":"uart_rx","trigger":{"kind":"AFTER_OUTPUT","mask":4294967295,"occurrence":1,"source_component":"cpu","source_port":"data_addr","value":1073741828},"value":0,"width":null},{"action_id":"frame-1-bit-5","bit_offset":0,"component":"uart","delay_component":"uart","delay_ticks":448,"direction":"IP_TO_CPU_TO_IP","port":"uart_rx","trigger":{"kind":"AFTER_OUTPUT","mask":4294967295,"occurrence":1,"source_component":"cpu","source_port":"data_addr","value":1073741828},"value":0,"width":null},{"action_id":"frame-1-bit-6","bit_offset":0,"component":"uart","delay_component":"uart","delay_ticks":512,"direction":"IP_TO_CPU_TO_IP","port":"uart_rx","trigger":{"kind":"AFTER_OUTPUT","mask":4294967295,"occurrence":1,"source_component":"cpu","source_port":"data_addr","value":1073741828},"value":1,"width":null},{"action_id":"frame-1-bit-7","bit_offset":0,"component":"uart","delay_component":"uart","delay_ticks":576,"direction":"IP_TO_CPU_TO_IP","port":"uart_rx","trigger":{"kind":"AFTER_OUTPUT","mask":4294967295,"occurrence":1,"source_component":"cpu","source_port":"data_addr","value":1073741828},"value":0,"width":null},{"action_id":"frame-1-bit-8","bit_offset":0,"component":"uart","delay_component":"uart","delay_ticks":640,"direction":"IP_TO_CPU_TO_IP","port":"uart_rx","trigger":{"kind":"AFTER_OUTPUT","mask":4294967295,"occurrence":1,"source_component":"cpu","source_port":"data_addr","value":1073741828},"value":1,"width":null},{"action_id":"frame-1-bit-9","bit_offset":0,"component":"uart","delay_component":"uart","delay_ticks":704,"direction":"IP_TO_CPU_TO_IP","port":"uart_rx","trigger":{"kind":"AFTER_OUTPUT","mask":4294967295,"occurrence":1,"source_component":"cpu","source_port":"data_addr","value":1073741828},"value":1,"width":null},{"action_id":"frame-2-bit-0","bit_offset":0,"component":"uart","delay_component":"uart","delay_ticks":128,"direction":"IP_TO_CPU_TO_IP","port":"uart_rx","trigger":{"kind":"AFTER_OUTPUT","mask":4294967295,"occurrence":1,"source_component":"cpu","source_port":"data_addr","value":1073745940},"value":0,"width":null},{"action_id":"frame-2-bit-1","bit_offset":0,"component":"uart","delay_component":"uart","delay_ticks":192,"direction":"IP_TO_CPU_TO_IP","port":"uart_rx","trigger":{"kind":"AFTER_OUTPUT","mask":4294967295,"occurrence":1,"source_component":"cpu","source_port":"data_addr","value":1073745940},"value":0,"width":null},{"action_id":"frame-2-bit-2","bit_offset":0,"component":"uart","delay_component":"uart","delay_ticks":256,"direction":"IP_TO_CPU_TO_IP","port":"uart_rx","trigger":{"kind":"AFTER_OUTPUT","mask":4294967295,"occurrence":1,"source_component":"cpu","source_port":"data_addr","value":1073745940},"value":0,"width":null},{"action_id":"frame-2-bit-3","bit_offset":0,"component":"uart","delay_component":"uart","delay_ticks":320,"direction":"IP_TO_CPU_TO_IP","port":"uart_rx","trigger":{"kind":"AFTER_OUTPUT","mask":4294967295,"occurrence":1,"source_component":"cpu","source_port":"data_addr","value":1073745940},"value":1,"width":null},{"action_id":"frame-2-bit-4","bit_offset":0,"component":"uart","delay_component":"uart","delay_ticks":384,"direction":"IP_TO_CPU_TO_IP","port":"uart_rx","trigger":{"kind":"AFTER_OUTPUT","mask":4294967295,"occurrence":1,"source_component":"cpu","source_port":"data_addr","value":1073745940},"value":1,"width":null},{"action_id":"frame-2-bit-5","bit_offset":0,"component":"uart","delay_component":"uart","delay_ticks":448,"direction":"IP_TO_CPU_TO_IP","port":"uart_rx","trigger":{"kind":"AFTER_OUTPUT","mask":4294967295,"occurrence":1,"source_component":"cpu","source_port":"data_addr","value":1073745940},"value":1,"width":null},{"action_id":"frame-2-bit-6","bit_offset":0,"component":"uart","delay_component":"uart","delay_ticks":512,"direction":"IP_TO_CPU_TO_IP","port":"uart_rx","trigger":{"kind":"AFTER_OUTPUT","mask":4294967295,"occurrence":1,"source_component":"cpu","source_port":"data_addr","value":1073745940},"value":1,"width":null},{"action_id":"frame-2-bit-7","bit_offset":0,"component":"uart","delay_component":"uart","delay_ticks":576,"direction":"IP_TO_CPU_TO_IP","port":"uart_rx","trigger":{"kind":"AFTER_OUTPUT","mask":4294967295,"occurrence":1,"source_component":"cpu","source_port":"data_addr","value":1073745940},"value":0,"width":null},{"action_id":"frame-2-bit-8","bit_offset":0,"component":"uart","delay_component":"uart","delay_ticks":640,"direction":"IP_TO_CPU_TO_IP","port":"uart_rx","trigger":{"kind":"AFTER_OUTPUT","mask":4294967295,"occurrence":1,"source_component":"cpu","source_port":"data_addr","value":1073745940},"value":0,"width":null},{"action_id":"frame-2-bit-9","bit_offset":0,"component":"uart","delay_component":"uart","delay_ticks":704,"direction":"IP_TO_CPU_TO_IP","port":"uart_rx","trigger":{"kind":"AFTER_OUTPUT","mask":4294967295,"occurrence":1,"source_component":"cpu","source_port":"data_addr","value":1073745940},"value":1,"width":null}],"direction":"IP_TO_CPU_TO_IP","encoding_version":2,"initial_images":[{"address":65664,"component":"cpu","data_hex":"b7000040370100401301210023a820001301200023a22000371200401301f00f23202202b70201009382021073905230b71200009382028073a042309302800073a002306f000000","image_id":"cpu.main"},{"address":65836,"component":"cpu","data_hex":"b700004003a1800137120040232a2200232020201300000013000000130000001300000013000000130000001300000013000000130000001300000013000000130000001300000013000000130000001300000073002030","image_id":"cpu.isr.vector"}],"max_steps":5400,"path_id":"uart-external-rx-rtl-fifo-irq-ibex-isr-gpio-out","schedule_order":["cpu","uart","gpio"],"testcase_id":"ibex-uart-rx-gpio-two-rounds"}
