{"actions":[],"direction":"CPU_TO_IP_TO_CPU","encoding_version":2,"initial_images":[{"address":65664,"component":"cpu","data_hex":"b7000040371200401301300023a2200023a62002b70201009382021073905230b71200009382028073a042309302800073a00230232a22006f000000","image_id":"cpu.main"},{"address":65792,"component":"cpu","data_hex":"b700004003a10001232020209301300023a0300037120040232a02001300000013000000232a320073002030","image_id":"cpu.isr"},{"address":65836,"component":"cpu","data_hex":"b700004003a10001232020209301300023a0300037120040232a02001300000013000000232a320073002030","image_id":"cpu.isr.vector"}],"max_steps":3600,"path_id":"cpu-program-a-output-b-irq-cpu-isr","schedule_order":["cpu","gpio_a","gpio_b"],"testcase_id":"cpu-a-b-cpu-value-3"}
