{"actions":[{"action_id":"rx_frame","bit_offset":0,"component":"uart0","delay_component":"uart0","delay_ticks":0,"direction":"IP_TO_CPU_TO_IP","port":"uart_rx_byte","trigger":{"kind":"START","mask":0,"occurrence":1,"source_component":"","source_port":"","value":0},"value":90,"width":8}],"direction":"IP_TO_CPU_TO_IP","encoding_version":2,"initial_images":[{"address":0,"component":"cpu","data_hex":"b70004001303000123a0600013011004930300029383f3ffe39e03fe23a620009304400183a2400093f21200639602009384f4ffe39804fe83a180003344310037120000232082006f000000","image_id":"cpu.program"}],"max_steps":1700,"path_id":"picorv32-axil-uart-ip-roundtrip","schedule_order":["cpu","uart0"],"testcase_id":"axil-picorv32-uart-ip-seed"}
