{"actions":[{"action_id":"external-first","bit_offset":0,"component":"spi_device","delay_component":"cpu","delay_ticks":30,"direction":"IP_TO_CPU_TO_IP","port":"frame_1","trigger":{"kind":"AFTER_OUTPUT","mask":4294967295,"occurrence":1,"source_component":"cpu","source_port":"data_addr","value":1073741828},"value":1193050,"width":null},{"action_id":"external-second","bit_offset":0,"component":"spi_device","delay_component":"cpu","delay_ticks":30,"direction":"IP_TO_CPU_TO_IP","port":"frame_2","trigger":{"kind":"AFTER_OUTPUT","mask":4294967295,"occurrence":1,"source_component":"cpu","source_port":"data_addr","value":1073741824},"value":5666982,"width":null}],"direction":"IP_TO_CPU_TO_IP","encoding_version":2,"initial_images":[{"address":65664,"component":"cpu","data_hex":"b7000040370101811301212023a4200a1301100023a2200093020020b7240040938404e0b70301009383c31273a05330b71300009383038073a043309303800073a003306f000000","image_id":"cpu.main"},{"address":65836,"component":"cpu","data_hex":"83a1400423a0320003a2800423a2420003a4040023a482009382c2009303100023a0700073002030","image_id":"cpu.isr"}],"max_steps":1600,"path_id":"external-spi-device-upload-irq-ibex-fifo-ram","schedule_order":["cpu","spi_device"],"testcase_id":"ibex-spi-device-two-uploads"}