{"actions":[{"action_id":"peer-first","bit_offset":0,"component":"i2c","delay_component":"","delay_ticks":0,"direction":"IP_TO_CPU","port":"peer_payload_1","trigger":{"kind":"START","mask":0,"occurrence":1,"source_component":"","source_port":"","value":0},"value":90,"width":null},{"action_id":"peer-second","bit_offset":0,"component":"i2c","delay_component":"","delay_ticks":0,"direction":"IP_TO_CPU","port":"peer_payload_2","trigger":{"kind":"AFTER_OUTPUT","mask":4294967295,"occurrence":1,"source_component":"cpu","source_port":"data_addr","value":512},"value":166,"width":null}],"direction":"IP_TO_CPU","encoding_version":2,"initial_images":[{"address":65664,"component":"cpu","data_hex":"b7000040370110001301010123ae2002370102001301210023a02004370108001301810023a22004370104001301410023a42004370108001301810023a620041301202023a220001301100023a820009302002013030000130400209304101a13051060b70301009383c31273a05330b71300009383038073a043309303800073a0033023ae900023aea0006f000000","image_id":"cpu.main"},{"address":65836,"component":"cpu","data_hex":"83a1800123a0320023a080009382420013031300130210006316430023ae900023aea0001300000013000000130000001300000013000000130000001300000013000000130000001300000013000000130000001300000013000000130000001300000073002030","image_id":"cpu.isr.vector"}],"max_steps":7000,"path_id":"i2c-peer-real-controller-irq-ibex-rdata-ram","schedule_order":["cpu","i2c"],"testcase_id":"ibex-i2c-two-rounds"}