{"actions":[],"direction":"CPU_TO_IP_TO_CPU","encoding_version":2,"initial_images":[{"address":2147483648,"component":"cpu","data_hex":"6f000008","image_id":"cpu.boot"},{"address":2147483776,"component":"cpu","data_hex":"b7000040371200401301100023a2200023a62002970200009382c20673905230b71200009382028073a042309302800073a00230232a22006f000000","image_id":"cpu.main"},{"address":2147483904,"component":"cpu","data_hex":"b700004003a10001970100009381810f23a0210023a0200037120040232a0200130000001300000013000000130000001300000013000000130000001300000013013000232a220073002030","image_id":"cpu.isr"},{"address":2147484160,"component":"cpu","data_hex":"00000000","image_id":"cpu.result"}],"max_steps":6000,"path_id":"cva6-a-b-cva6-two-rounds","schedule_order":["cpu","gpio_a","gpio_b"],"testcase_id":"cva6-cpu-two-gpio-two-rounds"}
