{"actions":[{"action_id":"first-rise","bit_offset":8,"component":"gpio_b","delay_component":"cpu","delay_ticks":100,"direction":"IP_TO_CPU_TO_IP","port":"gpio_in","trigger":{"kind":"AFTER_OUTPUT","mask":18446744073709551615,"occurrence":1,"source_component":"cpu","source_port":"addr","value":1073741868},"value":1,"width":24},{"action_id":"second-low","bit_offset":8,"component":"gpio_b","delay_component":"gpio_b","delay_ticks":0,"direction":"IP_TO_CPU_TO_IP","port":"gpio_in","trigger":{"kind":"AFTER_OUTPUT","mask":18446744073709551615,"occurrence":1,"source_component":"cpu","source_port":"addr","value":1073745940},"value":0,"width":24},{"action_id":"second-rise","bit_offset":8,"component":"gpio_b","delay_component":"gpio_b","delay_ticks":60,"direction":"IP_TO_CPU_TO_IP","port":"gpio_in","trigger":{"kind":"AFTER_OUTPUT","mask":18446744073709551615,"occurrence":1,"source_component":"cpu","source_port":"addr","value":1073741824},"value":1,"width":24}],"direction":"IP_TO_CPU_TO_IP","encoding_version":2,"initial_images":[{"address":2147483648,"component":"cpu","data_hex":"6f000008","image_id":"cpu.boot"},{"address":2147483776,"component":"cpu","data_hex":"b70000401301001023a2200023a62002970200009382020773905230b71200009382028073a042309302800073a002306f000000","image_id":"cpu.main"},{"address":2147483904,"component":"cpu","data_hex":"b700004003a1000137120040232a2200970100009381010f23a021009302001023a050001300000013000000130000001300000013000000130000001300000013000000130000001300000013000000130000001300000013000000130000001300000073002030","image_id":"cpu.isr"},{"address":2147484160,"component":"cpu","data_hex":"00000000","image_id":"cpu.result"}],"max_steps":3600,"path_id":"external-b-irq-cva6-isr-a-output","schedule_order":["cpu","gpio_b","gpio_a"],"testcase_id":"cva6-campaign-external-seed"}
